{
  "version": 1,
  "runId": "owned-form-example",
  "timeout_ms": 60000,
  "steps": [
    {"id":"locate","action":"locate","target":"name","value":null,"timeout_ms":10000},
    {"id":"name","action":"input","target":"name","value":"Ada","timeout_ms":10000},
    {"id":"quantity","action":"input","target":"quantity","value":2,"timeout_ms":10000},
    {"id":"save","action":"click","target":"save","value":null,"timeout_ms":10000},
    {"id":"receipt","action":"read","target":"receipt","value":null,"timeout_ms":10000},
    {"id":"verify","action":"assert","target":"receipt","value":1,"timeout_ms":10000}
  ]
}
